{
  "$schema": "https://json-schema.org/draft/2020-12/schema",
  "$id": "https://jamie-clayton.github.io/githerd-rules/subject-vocabulary/0.9/subject-vocabulary.schema.json",
  "$comment": "Subject Vocabulary Standard 0.9, a pre-release for testing before 1.0. SPDX-License-Identifier: Apache-2.0. Copyright 2026 Jamie Clayton. 0.x versions may still change within their folder; from 1.0, released versions are immutable and changes ship as a new major.minor folder. Rules that JSON Schema cannot express (SV001 onwards) are defined in the specification and checked by conformance tooling.",
  "title": "Subject vocabulary adoption register",
  "description": "A repository's docs/registers/subject-vocabulary.json: which release of the core scheme it pins, and whether it extends that scheme or replaces it with a private set (core), the local prefixes it uses, its own concepts and components, extra suggester hints, and a map from the tag strings it used before adopting. A register never redefines a core concept: ability: always means the core scheme. Envelope keys are Dublin Core terms and concept keys are SKOS terms; see context.jsonld.",
  "type": "object",
  "required": [
    "$schema",
    "title",
    "identifier",
    "modified"
  ],
  "properties": {
    "$schema": {
      "description": "The released version of this standard the register pins (dcterms:conformsTo). Must name a major.minor folder; there is no floating version.",
      "type": "string",
      "pattern": "^https://jamie-clayton\\.github\\.io/githerd-rules/subject-vocabulary/[0-9]+\\.[0-9]+/subject-vocabulary\\.schema\\.json$"
    },
    "title": { "description": "Name of the register (dcterms:title).", "$ref": "scheme.schema.json#/$defs/text" },
    "description": { "description": "What the register adds and why (dcterms:description).", "$ref": "scheme.schema.json#/$defs/text" },
    "identifier": { "description": "Persistent identifier of the register, as a URI such as an ARK (dcterms:identifier).", "$ref": "scheme.schema.json#/$defs/uri" },
    "creator": { "description": "Who authored the register (dcterms:creator).", "$ref": "scheme.schema.json#/$defs/text" },
    "contributor": { "description": "Others who contributed (dcterms:contributor).", "$ref": "scheme.schema.json#/$defs/textList" },
    "publisher": { "description": "The repository or organisation publishing the register (dcterms:publisher).", "$ref": "scheme.schema.json#/$defs/text" },
    "subject": { "description": "Keywords (dcterms:subject).", "$ref": "scheme.schema.json#/$defs/textList" },
    "created": { "description": "When the register was first created (dcterms:created).", "$ref": "scheme.schema.json#/$defs/dateOrDateTime" },
    "modified": { "description": "When the register last changed (dcterms:modified).", "$ref": "scheme.schema.json#/$defs/dateOrDateTime" },
    "version": { "description": "The register's own semantic version (dcterms:hasVersion), independent of the standard version in $schema.", "type": "string", "pattern": "^[0-9]+\\.[0-9]+\\.[0-9]+$" },
    "source": { "description": "The vocabulary this one was derived from (dcterms:source).", "$ref": "scheme.schema.json#/$defs/text" },
    "language": { "description": "BCP 47 language tag for labels and definitions (dcterms:language).", "type": "string", "pattern": "^[A-Za-z]{2,3}(-[A-Za-z0-9]{2,8})*$" },
    "coverage": { "description": "Which documents the register applies to: a repository, or path globs within one (dcterms:coverage).", "$ref": "scheme.schema.json#/$defs/text" },
    "rights": { "description": "Licence of the register, ideally an SPDX identifier (dcterms:rights).", "$ref": "scheme.schema.json#/$defs/text" },
    "references": { "description": "Related resources (dcterms:references).", "$ref": "scheme.schema.json#/$defs/textList" },
    "core": {
      "description": "extend (the default when absent): the core scheme's concepts plus this register's. replace: this register's concepts only; ability: notations then do not resolve here. Changing it is a major change of the register's version.",
      "enum": [ "extend", "replace" ]
    },
    "prefixes": {
      "description": "The local scheme prefixes this register opts into resolution. Absent means theme and component. ability is reserved for the core scheme and can never be declared.",
      "type": "array",
      "minItems": 1,
      "maxItems": 20,
      "uniqueItems": true,
      "items": { "type": "string", "pattern": "^[a-z][a-z0-9]*$", "not": { "const": "ability" } }
    },
    "conceptBase": {
      "description": "IRI base for this repository's local concepts; a concept's IRI is conceptBase + prefix + / + name. Two repositories may use the same local notation for different things, so local concepts are only ever compared within one repository.",
      "$ref": "scheme.schema.json#/$defs/uri"
    },
    "concepts": {
      "description": "Local concepts. One with no broader is a top concept; any declared prefix may hold top concepts.",
      "type": "array",
      "maxItems": 500,
      "items": { "$ref": "#/$defs/localConcept" }
    },
    "hints": {
      "description": "Extra suggester hints for concepts, keyed by notation. Additive only: a hint never changes a concept's labels or definition.",
      "type": "object",
      "maxProperties": 500,
      "propertyNames": { "$ref": "scheme.schema.json#/$defs/notation" },
      "additionalProperties": {
        "type": "object",
        "required": [ "hiddenLabel" ],
        "properties": {
          "hiddenLabel": { "type": "array", "$ref": "scheme.schema.json#/$defs/labelList", "minItems": 1 }
        },
        "additionalProperties": false
      }
    },
    "components": {
      "description": "Code areas of this repository, matched by path globs relative to the repository root. A document that mentions a component's path counts toward the component's broader concept.",
      "type": "array",
      "maxItems": 200,
      "items": {
        "type": "object",
        "required": [ "notation", "paths" ],
        "properties": {
          "notation": { "$ref": "scheme.schema.json#/$defs/notation" },
          "prefLabel": { "$ref": "scheme.schema.json#/$defs/label" },
          "paths": {
            "type": "array",
            "minItems": 1,
            "maxItems": 20,
            "items": { "type": "string", "minLength": 1, "maxLength": 200 },
            "uniqueItems": true
          },
          "broader": { "type": "array", "$ref": "scheme.schema.json#/$defs/notationList", "minItems": 1 },
          "extensions": { "$ref": "scheme.schema.json#/$defs/extensions" }
        },
        "additionalProperties": false
      }
    },
    "legacy": {
      "description": "Tag strings the repository used before adopting, each mapped to the concept that replaces it. Read by the suggester; the tag strings stay valid in documents.",
      "type": "object",
      "maxProperties": 1000,
      "propertyNames": { "$ref": "scheme.schema.json#/$defs/label" },
      "additionalProperties": { "$ref": "scheme.schema.json#/$defs/notation" }
    },
    "retired": {
      "description": "Local concepts no longer offered, each naming its replacement.",
      "type": "array",
      "maxItems": 500,
      "items": { "$ref": "scheme.schema.json#/$defs/retiredConcept" }
    },
    "extensions": { "$ref": "scheme.schema.json#/$defs/extensions" }
  },
  "if": {
    "type": "object",
    "properties": { "core": { "const": "replace" } },
    "required": [ "core" ]
  },
  "then": {
    "properties": { "concepts": { "type": "array", "minItems": 1 } },
    "required": [ "concepts" ]
  },
  "dependentRequired": {
    "concepts": [ "conceptBase" ],
    "components": [ "conceptBase" ]
  },
  "additionalProperties": false,
  "$defs": {
    "localConcept": {
      "type": "object",
      "$ref": "scheme.schema.json#/$defs/conceptBody",
      "$comment": "Shapes come from conceptBody; the true entries only declare which keys are required here. definition is recommended, not required, for a local concept.",
      "required": [ "notation", "prefLabel" ],
      "properties": {
        "notation": true,
        "prefLabel": true
      },
      "unevaluatedProperties": false
    }
  }
}
