{
  "$schema": "https://jamie-clayton.github.io/githerd-rules/subject-vocabulary/0.9/subject-vocabulary.schema.json",
  "title": "Example repository subject vocabulary",
  "identifier": "ark:/99999/sv8000p0000000000",
  "modified": "2026-10-08T21:00:00+10:00",
  "conceptBase": "https://example.org/repository/subjects/",
  "concepts": [
    {
      "notation": "theme:dashboard-ux",
      "prefLabel": "Dashboard UX",
      "broader": [
        "ability:discoverability"
      ]
    },
    {
      "notation": "area:billing",
      "prefLabel": "Billing",
      "definition": "Customers are invoiced correctly and on time."
    }
  ],
  "prefixes": [
    "theme",
    "component",
    "area"
  ],
  "components": [
    {
      "notation": "component:invoice-api",
      "paths": [
        "src/invoices/**"
      ]
    }
  ]
}
